id_review,caption,relative_date,retrieval_date,rating,username,n_review_user,n_photo_user,url_user,url_source,address
ChZDSUhNMG9nS0VJQ0FnSURjcW9HNGRnEAE,"Do not choose Delivery! They have a Private Company deliver, not their own personell. Had I seen the damage to my groceries, loss of product and dairy items left on the porch sitting in the hot Sun, the Driver’s next stop would have been to the ER. They credited My wife’s card for the items damaged, but that is still No Excuse!",10 months ago,2021-04-23 05:47:22.696238,1.0,J. Kevin Watts,1,0,https://www.google.com/maps/contrib/102295359579839709292/reviews?hl=en-US,"https://www.google.com/maps/place/BJ's+Wholesale+Club/@30.4972023,-87.2265766,17z/data=!3m1!4b1!4m5!3m4!1s0x8890bf749c883937:0x70dc63fc1cecbb3a!8m2!3d30.4972023!4d-87.224387","7005 N Davis Hwy, Pensacola, FL 32504"
ChZDSUhNMG9nS0VJQ0FnSURjOEtlZlFnEAE,,11 months ago,2021-04-23 05:47:22.700230,5.0,Mark Mears,0,0,https://www.google.com/maps/contrib/113212943138399301965/reviews?hl=en-US,"https://www.google.com/maps/place/BJ's+Wholesale+Club/@30.4972023,-87.2265766,17z/data=!3m1!4b1!4m5!3m4!1s0x8890bf749c883937:0x70dc63fc1cecbb3a!8m2!3d30.4972023!4d-87.224387","7005 N Davis Hwy, Pensacola, FL 32504"
ChZDSUhNMG9nS0VJQ0FnSURjb0tUQk5REAE,I love this store. Everyone is friendly and helpful. There is a variety of things. There are always great coupons and their app is amazing. The only thing that needs help is their gas station attendant. I have had a couple unfriendly experiences there.,11 months ago,2021-04-23 05:47:22.704207,4.0,Jenna Ferrell,6,0,https://www.google.com/maps/contrib/113498253347936730134/reviews?hl=en-US,"https://www.google.com/maps/place/BJ's+Wholesale+Club/@30.4972023,-87.2265766,17z/data=!3m1!4b1!4m5!3m4!1s0x8890bf749c883937:0x70dc63fc1cecbb3a!8m2!3d30.4972023!4d-87.224387","7005 N Davis Hwy, Pensacola, FL 32504"
ChZDSUhNMG9nS0VJQ0FnSURjb09pOFBBEAE,,11 months ago,2021-04-23 05:47:22.708236,5.0,Jennifer Rae Fuchek,0,0,https://www.google.com/maps/contrib/108199191419135561416/reviews?hl=en-US,"https://www.google.com/maps/place/BJ's+Wholesale+Club/@30.4972023,-87.2265766,17z/data=!3m1!4b1!4m5!3m4!1s0x8890bf749c883937:0x70dc63fc1cecbb3a!8m2!3d30.4972023!4d-87.224387","7005 N Davis Hwy, Pensacola, FL 32504"
ChdDSUhNMG9nS0VJQ0FnSUNjaDlMWDhRRRAB,"UPDATE: Registered a complaint via their website and was told someone would contact me within three days. It's been 1 week and nothing, so BJ's clearly doesn't care about customer satisfaction, just another corporate monster feeding on your …",11 months ago,2021-04-23 05:47:22.710202,1.0,Justin Time,36,0,https://www.google.com/maps/contrib/105926514683369069977/reviews?hl=en-US,"https://www.google.com/maps/place/BJ's+Wholesale+Club/@30.4972023,-87.2265766,17z/data=!3m1!4b1!4m5!3m4!1s0x8890bf749c883937:0x70dc63fc1cecbb3a!8m2!3d30.4972023!4d-87.224387","7005 N Davis Hwy, Pensacola, FL 32504"
ChZDSUhNMG9nS0VJQ0FnSUNjLTZyX2VREAE,,a year ago,2021-04-23 05:47:22.714220,5.0,Don Kline,6,0,https://www.google.com/maps/contrib/105045697844536341355/reviews?hl=en-US,"https://www.google.com/maps/place/BJ's+Wholesale+Club/@30.4972023,-87.2265766,17z/data=!3m1!4b1!4m5!3m4!1s0x8890bf749c883937:0x70dc63fc1cecbb3a!8m2!3d30.4972023!4d-87.224387","7005 N Davis Hwy, Pensacola, FL 32504"
ChZDSUhNMG9nS0VJQ0FnSUNjdTVHSlZ3EAE,"Place has a great atmosphere, lovely people, and good member services. The only time I have a bad time here is when it's crowded, which isn't the stores fault. Great place to shop. BJ's cares about their members. Highly recommend over other wholesale places.",a year ago,2021-04-23 05:47:22.718202,5.0,LUNY Tunez,0,0,https://www.google.com/maps/contrib/103664690665661876714/reviews?hl=en-US,"https://www.google.com/maps/place/BJ's+Wholesale+Club/@30.4972023,-87.2265766,17z/data=!3m1!4b1!4m5!3m4!1s0x8890bf749c883937:0x70dc63fc1cecbb3a!8m2!3d30.4972023!4d-87.224387","7005 N Davis Hwy, Pensacola, FL 32504"
ChZDSUhNMG9nS0VJQ0FnSUNjMjREaklnEAE,Similar to Sams.Blend of Sams and costco with better selection than Sams.,a year ago,2021-04-23 05:47:22.723201,4.0,Ed Taylor,3,0,https://www.google.com/maps/contrib/108210381480875087816/reviews?hl=en-US,"https://www.google.com/maps/place/BJ's+Wholesale+Club/@30.4972023,-87.2265766,17z/data=!3m1!4b1!4m5!3m4!1s0x8890bf749c883937:0x70dc63fc1cecbb3a!8m2!3d30.4972023!4d-87.224387","7005 N Davis Hwy, Pensacola, FL 32504"
ChdDSUhNMG9nS0VJQ0FnSUNjbmRhazBBRRAB,"Cashier Kita was amazing she went above and beyond, everyone was so helpful.",a year ago,2021-04-23 05:47:22.726237,5.0,Shonda McCorvey,4,0,https://www.google.com/maps/contrib/108324889251094012284/reviews?hl=en-US,"https://www.google.com/maps/place/BJ's+Wholesale+Club/@30.4972023,-87.2265766,17z/data=!3m1!4b1!4m5!3m4!1s0x8890bf749c883937:0x70dc63fc1cecbb3a!8m2!3d30.4972023!4d-87.224387","7005 N Davis Hwy, Pensacola, FL 32504"
ChZDSUhNMG9nS0VJQ0FnSUNjczd2d1dBEAE,"Very disappointed. The prices are cheaper at Sam's.  There was only one register open at BJ's (except the self checkouts, which did not want to work properly) and a whole line of people waiting to check out.  And then they would not take …",a year ago,2021-04-23 05:47:49.215501,2.0,Madeline Parris,7,0,https://www.google.com/maps/contrib/109192393944685417918/reviews?hl=en-US,"https://www.google.com/maps/place/BJ's+Wholesale+Club/@30.4972023,-87.2265766,17z/data=!3m1!4b1!4m5!3m4!1s0x8890bf749c883937:0x70dc63fc1cecbb3a!8m2!3d30.4972023!4d-87.224387","7005 N Davis Hwy, Pensacola, FL 32504"
ChZDSUhNMG9nS0VJQ0FnSUNjczZpTlRnEAE,Attempted to call BJs on several occasions with no success.  These attempts have been over the last two weeks.  On three occasions waited an hour or more.  Why don't they just say we don't answer the phones so don't even try. We are trying …,a year ago,2021-04-23 05:47:49.218499,1.0,Larmin Mottley,1,0,https://www.google.com/maps/contrib/107760660709581445969/reviews?hl=en-US,"https://www.google.com/maps/place/BJ's+Wholesale+Club/@30.4972023,-87.2265766,17z/data=!3m1!4b1!4m5!3m4!1s0x8890bf749c883937:0x70dc63fc1cecbb3a!8m2!3d30.4972023!4d-87.224387","7005 N Davis Hwy, Pensacola, FL 32504"
ChZDSUhNMG9nS0VJQ0FnSUNjMF8tbWNREAE,"The store is ok but whatever you do, don't order online! We have waited since opening day of the store for an online order and they keep refunding my account then holding the money again. There is no way to cancel on the website and the store says they can't do anything. If you call, you will sit on hold for HOURS!",a year ago,2021-04-23 05:47:49.221467,1.0,Amy Taylor,0,0,https://www.google.com/maps/contrib/107298590002046743264/reviews?hl=en-US,"https://www.google.com/maps/place/BJ's+Wholesale+Club/@30.4972023,-87.2265766,17z/data=!3m1!4b1!4m5!3m4!1s0x8890bf749c883937:0x70dc63fc1cecbb3a!8m2!3d30.4972023!4d-87.224387","7005 N Davis Hwy, Pensacola, FL 32504"
ChZDSUhNMG9nS0VJQ0FnSUNjMDdTLUtREAE,Prices and selection is somewhere good Meat and bakery choose are very good Checkout lines  and coupons things are bad/uncomfortable Will return only when pay-by-app will run,a year ago,2021-04-23 05:47:49.224467,3.0,dina gutu,0,0,https://www.google.com/maps/contrib/116923523203654219682/reviews?hl=en-US,"https://www.google.com/maps/place/BJ's+Wholesale+Club/@30.4972023,-87.2265766,17z/data=!3m1!4b1!4m5!3m4!1s0x8890bf749c883937:0x70dc63fc1cecbb3a!8m2!3d30.4972023!4d-87.224387","7005 N Davis Hwy, Pensacola, FL 32504"
ChZDSUhNMG9nS0VJQ0FnSUNjazZHRlp3EAE,I tried online and customer service at the Pensacola Florida store to get the problems solved with my membership. Stayed on the phone for an hour without any service. Tried the store's customer service and was told by (Joy) she was too busy …,a year ago,2021-04-23 05:47:49.228469,1.0,Patricia Krumel,0,0,https://www.google.com/maps/contrib/116277367526407537236/reviews?hl=en-US,"https://www.google.com/maps/place/BJ's+Wholesale+Club/@30.4972023,-87.2265766,17z/data=!3m1!4b1!4m5!3m4!1s0x8890bf749c883937:0x70dc63fc1cecbb3a!8m2!3d30.4972023!4d-87.224387","7005 N Davis Hwy, Pensacola, FL 32504"
ChZDSUhNMG9nS0VJQ0FnSUNjazViR09nEAE,"Used to go to BJ's all the time, then moved. I have been calling, emailing and anything else I could think of to get a location close by. I waited SIX YEARS for this location to pop up on the radar and now I'm so excited it's here! …",a year ago,2021-04-23 05:47:49.231465,5.0,Elizabeth Teresa Castellanos,0,0,https://www.google.com/maps/contrib/110799676008753170218/reviews?hl=en-US,"https://www.google.com/maps/place/BJ's+Wholesale+Club/@30.4972023,-87.2265766,17z/data=!3m1!4b1!4m5!3m4!1s0x8890bf749c883937:0x70dc63fc1cecbb3a!8m2!3d30.4972023!4d-87.224387","7005 N Davis Hwy, Pensacola, FL 32504"
ChZDSUhNMG9nS0VJQ0FnSUNjbzdIRFdREAE,I Love BJ's! Refreshing. Friendly. Clean. Member focused!,a year ago,2021-04-23 05:47:49.234469,5.0,Ie classic,0,0,https://www.google.com/maps/contrib/117059661661570617460/reviews?hl=en-US,"https://www.google.com/maps/place/BJ's+Wholesale+Club/@30.4972023,-87.2265766,17z/data=!3m1!4b1!4m5!3m4!1s0x8890bf749c883937:0x70dc63fc1cecbb3a!8m2!3d30.4972023!4d-87.224387","7005 N Davis Hwy, Pensacola, FL 32504"
ChZDSUhNMG9nS0VJQ0FnSUNjbzl5OVV3EAE,,a year ago,2021-04-23 05:47:49.238465,5.0,Hannah Altman,1,0,https://www.google.com/maps/contrib/100219491384341154779/reviews?hl=en-US,"https://www.google.com/maps/place/BJ's+Wholesale+Club/@30.4972023,-87.2265766,17z/data=!3m1!4b1!4m5!3m4!1s0x8890bf749c883937:0x70dc63fc1cecbb3a!8m2!3d30.4972023!4d-87.224387","7005 N Davis Hwy, Pensacola, FL 32504"
ChdDSUhNMG9nS0VJQ0FnSUNjdmZPbnB3RRAB,,a year ago,2021-04-23 05:47:49.241500,5.0,Kenneth Hicks,0,0,https://www.google.com/maps/contrib/100181237704228887846/reviews?hl=en-US,"https://www.google.com/maps/place/BJ's+Wholesale+Club/@30.4972023,-87.2265766,17z/data=!3m1!4b1!4m5!3m4!1s0x8890bf749c883937:0x70dc63fc1cecbb3a!8m2!3d30.4972023!4d-87.224387","7005 N Davis Hwy, Pensacola, FL 32504"
ChZDSUhNMG9nS0VJQ0FnSUNjblp6UmZ3EAE,Coupons are deceiving! Make sure you read carefully!,a year ago,2021-04-23 05:47:49.243466,1.0,Tucsun Mills,2,0,https://www.google.com/maps/contrib/109641049904606940284/reviews?hl=en-US,"https://www.google.com/maps/place/BJ's+Wholesale+Club/@30.4972023,-87.2265766,17z/data=!3m1!4b1!4m5!3m4!1s0x8890bf749c883937:0x70dc63fc1cecbb3a!8m2!3d30.4972023!4d-87.224387","7005 N Davis Hwy, Pensacola, FL 32504"
ChZDSUhNMG9nS0VJQ0FnSUNjemYtMmF3EAE,,a year ago,2021-04-23 05:48:15.734131,5.0,Karen Byers,14,0,https://www.google.com/maps/contrib/104188450949245326649/reviews?hl=en-US,"https://www.google.com/maps/place/BJ's+Wholesale+Club/@30.4972023,-87.2265766,17z/data=!3m1!4b1!4m5!3m4!1s0x8890bf749c883937:0x70dc63fc1cecbb3a!8m2!3d30.4972023!4d-87.224387","7005 N Davis Hwy, Pensacola, FL 32504"
ChZDSUhNMG9nS0VJQ0FnSUNjdGM2NlZREAE,,a year ago,2021-04-23 05:48:15.737021,4.0,Merry Mac,0,0,https://www.google.com/maps/contrib/106272276373695655917/reviews?hl=en-US,"https://www.google.com/maps/place/BJ's+Wholesale+Club/@30.4972023,-87.2265766,17z/data=!3m1!4b1!4m5!3m4!1s0x8890bf749c883937:0x70dc63fc1cecbb3a!8m2!3d30.4972023!4d-87.224387","7005 N Davis Hwy, Pensacola, FL 32504"
ChZDSUhNMG9nS0VJQ0FnSUNjaGItc0J3EAE,,a year ago,2021-04-23 05:48:15.740019,5.0,Luke Henley,8,0,https://www.google.com/maps/contrib/110423908887579643430/reviews?hl=en-US,"https://www.google.com/maps/place/BJ's+Wholesale+Club/@30.4972023,-87.2265766,17z/data=!3m1!4b1!4m5!3m4!1s0x8890bf749c883937:0x70dc63fc1cecbb3a!8m2!3d30.4972023!4d-87.224387","7005 N Davis Hwy, Pensacola, FL 32504"
ChZDSUhNMG9nS0VJQ0FnSUNjOGR5S1RREAE,"Finally people we have a great store to shop, And I do all the shopping, people who work there SMILE AND ARE FRIENDLY, Clean, great prices, was treated as a human,and no person was rude in any way, Rob, one manager is outstanding.",a year ago,2021-04-23 05:48:15.743023,5.0,Larry Marley,13,0,https://www.google.com/maps/contrib/104802480264284456858/reviews?hl=en-US,"https://www.google.com/maps/place/BJ's+Wholesale+Club/@30.4972023,-87.2265766,17z/data=!3m1!4b1!4m5!3m4!1s0x8890bf749c883937:0x70dc63fc1cecbb3a!8m2!3d30.4972023!4d-87.224387","7005 N Davis Hwy, Pensacola, FL 32504"
ChZDSUhNMG9nS0VJQ0FnSUNjb2FYQ0pBEAE,Wow...opening day was crazy.  Packed...couldn't navigate the isles.  They ran out of carts.  Checkout was super slow.  None of the conveyor belts at the registers worked...slowing down the cashiers.  All the mailed membership gift cards …,a year ago,2021-04-23 05:48:15.748020,2.0,Mark K,0,0,https://www.google.com/maps/contrib/111367058243774517913/reviews?hl=en-US,"https://www.google.com/maps/place/BJ's+Wholesale+Club/@30.4972023,-87.2265766,17z/data=!3m1!4b1!4m5!3m4!1s0x8890bf749c883937:0x70dc63fc1cecbb3a!8m2!3d30.4972023!4d-87.224387","7005 N Davis Hwy, Pensacola, FL 32504"
ChZDSUhNMG9nS0VJQ0FnSUNjd2FmNk13EAE,"Went for the first time and was happy. It's much better than Sams! Love that you can use manufactures and that they have a deli. The only complaint that I have is the cashier that checked us out, was not friendly at all, she was very rude! Other than the cashier, everything was great!",a year ago,2021-04-23 05:48:15.752058,4.0,Marie L,58,0,https://www.google.com/maps/contrib/108374800008351349994/reviews?hl=en-US,"https://www.google.com/maps/place/BJ's+Wholesale+Club/@30.4972023,-87.2265766,17z/data=!3m1!4b1!4m5!3m4!1s0x8890bf749c883937:0x70dc63fc1cecbb3a!8m2!3d30.4972023!4d-87.224387","7005 N Davis Hwy, Pensacola, FL 32504"
ChdDSUhNMG9nS0VJQ0FnSUNjNXBpMGlRRRAB,"Was excited to go to the new warehouse option in Pensacola. Got the membership early and finally went shopping this week. While their house brands were different, most everything else was the same. Prices on the few items I compared were a …",a year ago,2021-04-23 05:48:15.755020,3.0,Citizen Pensacola,1,0,https://www.google.com/maps/contrib/108063337958127685004/reviews?hl=en-US,"https://www.google.com/maps/place/BJ's+Wholesale+Club/@30.4972023,-87.2265766,17z/data=!3m1!4b1!4m5!3m4!1s0x8890bf749c883937:0x70dc63fc1cecbb3a!8m2!3d30.4972023!4d-87.224387","7005 N Davis Hwy, Pensacola, FL 32504"
ChZDSUhNMG9nS0VJQ0FnSUNjdXRYbEpnEAE,This place is brand new so super clean and they are all so very friendly and helpful. Get the app and you will love the ease of the coupon system! I had to wait for my hubs for about 10 minutes to do something on our account and while …,a year ago,2021-04-23 05:48:15.758055,5.0,MK Chapman,0,0,https://www.google.com/maps/contrib/112809175030103829418/reviews?hl=en-US,"https://www.google.com/maps/place/BJ's+Wholesale+Club/@30.4972023,-87.2265766,17z/data=!3m1!4b1!4m5!3m4!1s0x8890bf749c883937:0x70dc63fc1cecbb3a!8m2!3d30.4972023!4d-87.224387","7005 N Davis Hwy, Pensacola, FL 32504"
ChdDSUhNMG9nS0VJQ0FnSURzaGZ1Q25RRRAB,,a year ago,2021-04-23 05:48:15.762059,5.0,Lutonya White,0,0,https://www.google.com/maps/contrib/104285591717766439677/reviews?hl=en-US,"https://www.google.com/maps/place/BJ's+Wholesale+Club/@30.4972023,-87.2265766,17z/data=!3m1!4b1!4m5!3m4!1s0x8890bf749c883937:0x70dc63fc1cecbb3a!8m2!3d30.4972023!4d-87.224387","7005 N Davis Hwy, Pensacola, FL 32504"
ChZDSUhNMG9nS0VJQ0FnSURzLWZ5UkxREAE,Found out  what B J stands for....Bad Joke!  I hope i can get a refund on membership,a year ago,2021-04-23 05:48:15.767023,1.0,Billy harrington,0,0,https://www.google.com/maps/contrib/101304439299781718779/reviews?hl=en-US,"https://www.google.com/maps/place/BJ's+Wholesale+Club/@30.4972023,-87.2265766,17z/data=!3m1!4b1!4m5!3m4!1s0x8890bf749c883937:0x70dc63fc1cecbb3a!8m2!3d30.4972023!4d-87.224387","7005 N Davis Hwy, Pensacola, FL 32504"
ChdDSUhNMG9nS0VJQ0FnSURzdWV6U21BRRAB,,a year ago,2021-04-23 05:48:42.340152,5.0,Evelyn Spain,2,0,https://www.google.com/maps/contrib/111998702286614073730/reviews?hl=en-US,"https://www.google.com/maps/place/BJ's+Wholesale+Club/@30.4972023,-87.2265766,17z/data=!3m1!4b1!4m5!3m4!1s0x8890bf749c883937:0x70dc63fc1cecbb3a!8m2!3d30.4972023!4d-87.224387","7005 N Davis Hwy, Pensacola, FL 32504"
ChdDSUhNMG9nS0VJQ0FnSURzMmFpeTR3RRAB,,a year ago,2021-04-23 05:48:42.343153,5.0,Demetrius Gant,0,0,https://www.google.com/maps/contrib/106872020384655778657/reviews?hl=en-US,"https://www.google.com/maps/place/BJ's+Wholesale+Club/@30.4972023,-87.2265766,17z/data=!3m1!4b1!4m5!3m4!1s0x8890bf749c883937:0x70dc63fc1cecbb3a!8m2!3d30.4972023!4d-87.224387","7005 N Davis Hwy, Pensacola, FL 32504"
ChZDSUhNMG9nS0VJQ0FnSURzaVpyeEJnEAE,"Same quality as other warehouses I have been into. Was very busy given it was grand opening weekend, but expect it to be an amazing staple to our town. Great prices, and great items, but like all warehouses have to watch some are better buys and some are not.",a year ago,2021-04-23 05:48:42.345120,4.0,Bennetts Xventures,0,0,https://www.google.com/maps/contrib/104364415926272901523/reviews?hl=en-US,"https://www.google.com/maps/place/BJ's+Wholesale+Club/@30.4972023,-87.2265766,17z/data=!3m1!4b1!4m5!3m4!1s0x8890bf749c883937:0x70dc63fc1cecbb3a!8m2!3d30.4972023!4d-87.224387","7005 N Davis Hwy, Pensacola, FL 32504"
ChdDSUhNMG9nS0VJQ0FnSURzNFoyYnFRRRAB,Packed and lots of variety however the prices are about the same and in some cases more than Sams club.,a year ago,2021-04-23 05:48:42.349116,4.0,Jimmie Rodgers,0,0,https://www.google.com/maps/contrib/105891329586081704992/reviews?hl=en-US,"https://www.google.com/maps/place/BJ's+Wholesale+Club/@30.4972023,-87.2265766,17z/data=!3m1!4b1!4m5!3m4!1s0x8890bf749c883937:0x70dc63fc1cecbb3a!8m2!3d30.4972023!4d-87.224387","7005 N Davis Hwy, Pensacola, FL 32504"
ChdDSUhNMG9nS0VJQ0FnSURzZ1lmZWx3RRAB,New business,a year ago,2021-04-23 05:48:42.353121,5.0,Tam Vuong,1,0,https://www.google.com/maps/contrib/108331615776906448197/reviews?hl=en-US,"https://www.google.com/maps/place/BJ's+Wholesale+Club/@30.4972023,-87.2265766,17z/data=!3m1!4b1!4m5!3m4!1s0x8890bf749c883937:0x70dc63fc1cecbb3a!8m2!3d30.4972023!4d-87.224387","7005 N Davis Hwy, Pensacola, FL 32504"
ChdDSUhNMG9nS0VJQ0FnSURzcHJYNi1RRRAB,VERY MISLEADING ON THE WHOLE DEAL!! IF you get their CC you get a huge discount other than that they will sell you a 55$ membership which you get a 35$ gift card and pay gas prices you can find in town w out the yearly membership BS!,a year ago,2021-04-23 05:48:42.357155,3.0,Terri Clardy,16,0,https://www.google.com/maps/contrib/101030447312961118389/reviews?hl=en-US,"https://www.google.com/maps/place/BJ's+Wholesale+Club/@30.4972023,-87.2265766,17z/data=!3m1!4b1!4m5!3m4!1s0x8890bf749c883937:0x70dc63fc1cecbb3a!8m2!3d30.4972023!4d-87.224387","7005 N Davis Hwy, Pensacola, FL 32504"
ChZDSUhNMG9nS0VJQ0FnSURzMHR1cVJ3EAE,A little misleading on actual gas prices... #CmonMan,a year ago,2021-04-23 05:48:42.361151,4.0,Coach John,0,0,https://www.google.com/maps/contrib/109786913608487297056/reviews?hl=en-US,"https://www.google.com/maps/place/BJ's+Wholesale+Club/@30.4972023,-87.2265766,17z/data=!3m1!4b1!4m5!3m4!1s0x8890bf749c883937:0x70dc63fc1cecbb3a!8m2!3d30.4972023!4d-87.224387","7005 N Davis Hwy, Pensacola, FL 32504"
ChZDSUhNMG9nS0VJQ0FnSUNza2RlM0hREAE,Trying to get employment with them all I get is the runaround and phone tag.,a year ago,2021-04-23 05:48:42.365126,3.0,Cyndi Moore,0,0,https://www.google.com/maps/contrib/101351646405398983147/reviews?hl=en-US,"https://www.google.com/maps/place/BJ's+Wholesale+Club/@30.4972023,-87.2265766,17z/data=!3m1!4b1!4m5!3m4!1s0x8890bf749c883937:0x70dc63fc1cecbb3a!8m2!3d30.4972023!4d-87.224387","7005 N Davis Hwy, Pensacola, FL 32504"
ChZDSUhNMG9nS0VJQ0FnSUNzenFLek93EAE,Awesome got signed up with a 70dollar gift card plus they let you coupon💯,a year ago,2021-04-23 05:48:42.370116,5.0,Mr Every Thang,0,0,https://www.google.com/maps/contrib/118236829433668678863/reviews?hl=en-US,"https://www.google.com/maps/place/BJ's+Wholesale+Club/@30.4972023,-87.2265766,17z/data=!3m1!4b1!4m5!3m4!1s0x8890bf749c883937:0x70dc63fc1cecbb3a!8m2!3d30.4972023!4d-87.224387","7005 N Davis Hwy, Pensacola, FL 32504"
ChdDSUhNMG9nS0VJQ0FnSUNzcXZ1OW1BRRAB,Can’t wait to try it out! Five Stars because you came here and offered 140 new jobs to our area!,a year ago,2021-04-23 05:48:42.373153,5.0,Amanda Clark,0,0,https://www.google.com/maps/contrib/116188084405182784706/reviews?hl=en-US,"https://www.google.com/maps/place/BJ's+Wholesale+Club/@30.4972023,-87.2265766,17z/data=!3m1!4b1!4m5!3m4!1s0x8890bf749c883937:0x70dc63fc1cecbb3a!8m2!3d30.4972023!4d-87.224387","7005 N Davis Hwy, Pensacola, FL 32504"
ChZDSUhNMG9nS0VJQ0FnSURNXzRmV0JREAE,"Well Costco may be better?  How would one know? I didnt know the title for this location was ""Which is better Costco or BJs."" I could have sworn this  was just for BJs member services 😱. At least BJs is giving Pensacola a chance and …",a year ago,2021-04-23 05:49:08.954018,5.0,Jennifer Luthye,4,0,https://www.google.com/maps/contrib/107851951142988049406/reviews?hl=en-US,"https://www.google.com/maps/place/BJ's+Wholesale+Club/@30.4972023,-87.2265766,17z/data=!3m1!4b1!4m5!3m4!1s0x8890bf749c883937:0x70dc63fc1cecbb3a!8m2!3d30.4972023!4d-87.224387","7005 N Davis Hwy, Pensacola, FL 32504"
ChdDSUhNMG9nS0VJQ0FnSUNNcXFMUV9RRRAB,Friendly staff. Signed up for membership and received free gifts. I hope the store saves me money.,a year ago,2021-04-23 05:49:08.958019,5.0,David B,0,0,https://www.google.com/maps/contrib/105532149790811016601/reviews?hl=en-US,"https://www.google.com/maps/place/BJ's+Wholesale+Club/@30.4972023,-87.2265766,17z/data=!3m1!4b1!4m5!3m4!1s0x8890bf749c883937:0x70dc63fc1cecbb3a!8m2!3d30.4972023!4d-87.224387","7005 N Davis Hwy, Pensacola, FL 32504"
